release_date,title,overview,popularity,vote_count,vote_average,original_language,genre,poster_url,imdb_id,cast,director,runtime
25/12/1993,Batman: Mask of the Phantasm,"An old flame of Bruce Wayne's strolls into town, re-heating up the romance between the two. At the same time, a mass murderer with an axe for one hand begins systematically eliminating Gotham's crime bosses. Due to the person's dark appearance, he is mistaken for Batman. Now on the run, Batman must solve the mystery and deal with the romance between him and Andrea Beaumont.",29.132,773,7.5,en,"Action, Animation, Crime, Mystery",https://image.tmdb.org/t/p/original/l4jaQjkgznu2Rz05X18f24UjPNW.jpg,tt0106364,"Kevin Conroy|Dana Delany|Efrem Zimbalist, Jr.|Mark Hamill|Hart Bochner",Bruce Timm|Eric Radomski,76,,
28/05/1992,Sister Act,"A Reno singer witnesses a mob murder and the cops stash her in a nunnery to protect her from the hitmen. The mother superior does not trust her, and takes steps to limit her influence on the other nuns. Eventually the singer rescues the failing choir and begins helping with community projects, which gets her an interview on TV.",19.324,2547,6.8,en,"Music, Comedy",https://image.tmdb.org/t/p/original/xZvVSZ0RTxIjblLV87vs7ADM12m.jpg,tt0105417,Whoopi Goldberg|Maggie Smith|Kathy Najimy|Wendy Makkena|Mary Wickes,Emile Ardolino,100,,
9/12/1993,Sister Act 2: Back in the Habit,"Deloris Van Cartier is again asked to don the nun's habit to help a run-down Catholic school, presided over by Mother Superior. And if trying to reach out to a class full of uninterested students wasn't bad enough, the sisters discover that the school is due to be closed by the unscrupulous local authority chief Mr. Crisp.",17.196,1416,6.4,en,"Music, Comedy",https://image.tmdb.org/t/p/original/dlkBp5S6Ei5f54031rAhyb4IwML.jpg,tt0108147,Whoopi Goldberg|Kathy Najimy|James Coburn|Barnard Hughes|Mary Wickes,Bill Duke,107,,
10/1/1992,The Hand that Rocks the Cradle,"A suburban family chooses seemingly sweet Peyton Flanders as their newborn's nanny. Only much later does the infant's mother, Claire Bartel, realize Peyton's true intentions -- to destroy Claire and replace her in the family. The nail-biting suspense builds quickly in this chilling psychological thriller about deception and bitter revenge.",17.211,666,6.8,en,"Drama, Thriller",https://image.tmdb.org/t/p/original/8Ktj8PuupTIFIUIiuOqxfKKg2c2.jpg,tt0104389,Annabella Sciorra|Rebecca De Mornay|Matt McCoy|Ernie Hudson|Madeline Zima,Curtis Hanson,110,,
15/01/1993,Alive,"The amazing, true story of a Uruguayan rugby team's plane that crashed in the middle of the Andes mountains, and their immense will to survive and pull through alive, forced to do anything and everything they could to stay alive on meager rations and through the freezing cold.",23.311,1105,6.9,en,"Adventure, Drama, Thriller",https://image.tmdb.org/t/p/original/uQACcCZqd7WCTRin9xRIW5gr1bd.jpg,tt0106246,Ethan Hawke|Vincent Spano|Bruce Ramsay|David Kriegel|Josh Hamilton,Frank Marshall,120,,
23/12/1992,Scent of a Woman,"Charlie Simms (Chris O'Donnell) is a student at a private preparatory school who comes from a poor family. To earn the money for his flight home to Gresham, Oregon for Christmas, Charlie takes a job over Thanksgiving looking after retired U.S. Army officer Lieutenant Colonel Frank Slade (Al Pacino), a cantankerous middle-aged man who lives with his niece and her family.",23.109,2458,7.7,en,Drama,https://image.tmdb.org/t/p/original/4adI7IaveWb7EidYXfLb3MK3CgO.jpg,tt0105323,Al Pacino|Chris O'Donnell|James Rebhorn|Gabrielle Anwar|Philip Seymour Hoffman,Martin Brest,157,,
14/02/1992,Wayne's World,"When a sleazy TV exec offers Wayne and Garth a fat contract to tape their late-night public access show at his network, they can't believe their good fortune. But they soon discover the road from basement to big-time is a gnarly one, fraught with danger, temptation and ragin' party opportunities.",17.063,1747,6.7,en,"Comedy, Music",https://image.tmdb.org/t/p/original/rsgklbt5KxeuUuchehnLACxzisP.jpg,tt0105793,Mike Myers|Dana Carvey|Rob Lowe|Tia Carrere|Lara Flynn Boyle,Penelope Spheeris,94,,
10/12/1993,Wayne's World 2,"A message from Jim Morrison in a dream prompts cable access TV stars Wayne and Garth to put on a rock concert, ""Waynestock,"" with Aerosmith as headliners. But amid the preparations, Wayne frets that a record producer is putting the moves on his girlfriend, Cassandra, while Garth handles the advances of mega-babe Honey Hornee.",19.709,788,6.1,en,"Comedy, Music",https://image.tmdb.org/t/p/original/4b7skjfBrQTJ8VVMZ2B4guY0Fhg.jpg,tt0108525,Mike Myers|Dana Carvey|Christopher Walken|Tia Carrere|Chris Farley,Stephen Surjik,95,,
1/7/1992,A League of Their Own,"Small-town sisters Dottie and Kit join an all-female baseball league formed after World War II brings pro baseball to a standstill. When their team hits the road with its drunken coach, the siblings find troubles and triumphs on and off the field.",16.187,1048,7.2,en,"Comedy, Drama, Family",https://image.tmdb.org/t/p/original/7xpFXAOjgzFPE3vyVerFGfrXhFK.jpg,tt0104694,Tom Hanks|Geena Davis|Madonna|Lori Petty|Jon Lovitz,Penny Marshall,128,,
4/6/1992,Patriot Games,"When CIA Analyst Jack Ryan interferes with an IRA assassination, a renegade faction targets Jack and his family as revenge.",17.251,1227,6.7,en,"Drama, Action, Thriller, Crime",https://image.tmdb.org/t/p/original/9IT7gnszrRthduYxCLqaIkM55Un.jpg,tt0105112,Harrison Ford|Anne Archer|Patrick Bergin|Thora Birch|James Fox,Phillip Noyce,117,,
25/11/1992,The Bodyguard,"A former Secret Service agent grudgingly takes an assignment to protect a pop idol who's threatened by a crazed fan. At first, the safety-obsessed bodyguard and the self-indulgent diva totally clash. But before long, all that tension sparks fireworks of another sort, and the love-averse tough guy is torn between duty and romance.",26.33,2280,6.6,en,"Thriller, Action, Drama, Music, Romance",https://image.tmdb.org/t/p/original/2VgZW2ZD3pNoV2j8U2GXNRwOsk9.jpg,tt0103855,Whitney Houston|Kevin Costner|Michele Lamar Richards|Ralph Waite|Gary Kemp,Mick Jackson,129,,
30/07/1992,Death Becomes Her,"Madeline is married to Ernest, who was once arch-rival Helen's fiance. After recovering from a mental breakdown, Helen vows to kill Madeline and steal back Ernest. Unfortunately for everyone, the introduction of a magic potion causes things to be a great deal more complicated than a mere murder plot.",25.87,2002,6.7,en,"Comedy, Fantasy, Horror",https://image.tmdb.org/t/p/original/hXKmJZ7SUPlwgLbaKuk2FT9M5Gz.jpg,tt0104070,Meryl Streep|Bruce Willis|Goldie Hawn|Isabella Rossellini|Ian Ogilvy,Robert Zemeckis,104,,
22/05/1992,Far and Away,"A young man (Cruise) leaves Ireland with his landlord's daughter (Kidman) after some trouble with her father, and they dream of owning land at the big giveaway in Oklahoma ca. 1893. When they get to the new land, they find jobs and begin saving money. The man becomes a local barehands boxer, and rides in glory until he is beaten, then his employers steal all the couple's money and they must fight off starvation in the winter, and try to keep their dream of owning land alive. Meanwhile, the woman's parents find out where she has gone and have come to America to find her and take her back.",14.019,954,6.7,en,"Adventure, Drama, Romance, Western",https://image.tmdb.org/t/p/original/rbxvGXcD7fixrAsbiAYl9R76uDs.jpg,tt0104231,Tom Cruise|Nicole Kidman|Thomas Gibson|Robert Prosky|Barbara Babcock,Ron Howard,140,,
26/03/1992,White Men Can't Jump,"Billy Hoyle (Woody Harrelson) and Sidney Deane (Wesley Snipes) are an unlikely pair of basketball hustlers. They team up to con their way across the courts of Los Angeles, playing a game that's fast dangerous - and funny.",17.161,974,6.6,en,"Comedy, Drama",https://image.tmdb.org/t/p/original/jnI05Z2Cm9ACEJo8FGen7tdHKLl.jpg,tt0105812,Wesley Snipes|Woody Harrelson|Rosie Perez|Tyra Ferrell|Cylk Cozart,Ron Shelton,115,,
24/07/1992,Buffy the Vampire Slayer,"Blonde, bouncy Buffy is your typical high school cheerleader-- her goal is to ""marry Christian Slater and die"" and nothing gets in her way when it's time to shop. But all that changes when a strange man informs her she's been chosen by fate to kill vampires. With the help of a romantic rebel, Buffy is soon spending school nights protecting L.A. from Lothos, the Vampire King, his sidekick. Lefty and their determined gang of bloodsuckers. It's everything you'd expect from a teen queen in the Valley.",18.053,602,5.6,en,"Action, Comedy, Horror",https://image.tmdb.org/t/p/original/tcF3S4UdFpuoZEWovMDq5AXazNF.jpg,tt0103893,Kristy Swanson|Donald Sutherland|Paul Reubens|Rutger Hauer|Luke Perry,Fran Rubel Kuzui,86,,
4/9/1992,El Mariachi,"El Mariachi just wants to play his guitar and carry on the family tradition. Unfortunately, the town he tries to find work in has another visitor...a killer who carries his guns in a guitar case. The drug lord and his henchmen mistake El Mariachi for the killer, Azul, and chase him around town trying to kill him and get his guitar case.",16.035,851,6.7,es,"Action, Crime, Thriller",https://image.tmdb.org/t/p/original/zRh7K4SV1xQ419m8gzGITak51vc.jpg,tt0104815,Carlos Gallardo|Jaime de Hoyos|Peter Marquardt|Reinol Martinez|Ramiro Gomez,Robert Rodriguez,81,,
21/02/1992,Stop! Or My Mom Will Shoot,"A tough cop's (Sylvester Stallone) seemingly frail mother (Estelle Getty) comes to stay with him and progressively interferes in his life. She buys him an illegal MAC-10 machine pistol and starts poking around in his police cases. Eventually, the film draws to a denouement involving the title of the film and the revelation that even though she seems frail and weak she is capable of strong actions in some circumstances, i.e. when her son is threatened by thugs and she shoots herself in the shoulder.",14.284,788,5.3,en,"Action, Comedy",https://image.tmdb.org/t/p/original/meHDNuHPqCTOjgU3COImhxVa5H0.jpg,tt0105477,Sylvester Stallone|Estelle Getty|JoBeth Williams|Roger Rees|Martin Ferrero,Roger Spottiswoode,87,,
16/12/1992,Forever Young,A 1939 test pilot asks his best friend to use him as a guinea pig for a cryogenics experiment. Daniel McCormick wants to be frozen for a year so that he doesn't have to watch his love lying in a coma. The next thing Daniel knows is that he's been awoken in 1992.,15.194,690,6.4,en,"Adventure, Fantasy, Drama, Science Fiction, Romance",https://image.tmdb.org/t/p/original/1emjW7UqtVWsn6P6YPg8NFNnmen.jpg,tt0104291,Mel Gibson|Jamie Lee Curtis|Elijah Wood|Isabel Glasser|George Wendt,Steve Miner,102,,
27/03/1992,The Cutting Edge,"Two former Olympians, one a figure skater and the other a hockey player, pin their hopes of one last shot at Olympic glory on one another. That is, of course, if they can keep from killing each other in the process...",15.45,247,7.2,en,"Comedy, Drama, Romance",https://image.tmdb.org/t/p/original/f46oRkJXQgcfKsab7nWMG6Gjc6b.jpg,tt0104040,D. B. Sweeney|Moira Kelly|Roy Dotrice|Terry O'Quinn|Dwier Brown,Paul Michael Glaser,101,,
16/09/1992,Of Mice and Men,"Two drifters, one a gentle but slow giant, try to make money working the fields during the Depression so they can fulfill their dreams.",14.382,463,7.3,en,Drama,https://image.tmdb.org/t/p/original/suX9HIS22oJf0qoZV7DUvDWtWnV.jpg,tt0105046,John Malkovich|Gary Sinise|Ray Walston|Casey Siemaszko|Sherilyn Fenn,Gary Sinise,110,,
16/09/1992,Bad Lieutenant,"While investigating a young nun's rape, a corrupt New York City police detective, with a serious drug and gambling addiction, tries to change his ways and find forgiveness.",14.071,626,7.1,en,"Crime, Drama",https://image.tmdb.org/t/p/original/mVJ2mXykqq3t2v1nuouf1P10g0d.jpg,tt0103759,Harvey Keitel|Victor Argo|Frankie Thorn|Robin Burrows|Paul Calderon,Abel Ferrara,96,,
3/2/2000,Scream 3,"A murdering spree begins to happen again, this time its targeted toward the original Woodsboro survivors and those associated with the movie inside a movie, 'Stab 3'. Sydney must face the demons of her past to stop the killer.",56.004,2436,5.9,en,"Horror, Mystery",https://image.tmdb.org/t/p/original/geD86M58Zkv6O6lLbA1tHllH8B4.jpg,tt0134084,David Arquette|Neve Campbell|Courteney Cox|Patrick Dempsey|Scott Foley,Wes Craven,116,,
22/01/1999,The Boondock Saints,"With a God-inspired moral obligation to act against evil, twin brothers Conner and Murphy set out to rid Boston of criminals. However, rather than working within the system, these Irish Americans decide to take swift retribution into their own hands.",18.415,1872,7.3,en,"Action, Thriller, Crime",https://image.tmdb.org/t/p/original/gj3V39yiGPH1FAylXxzzVneflxA.jpg,tt0144117,Willem Dafoe|Norman Reedus|Sean Patrick Flanery|David Della Rocco|David Ferry,Troy Duffy,108,,
3/2/2000,The Beach,"Twenty-something Richard travels to Thailand and finds himself in possession of a strange map. Rumours state that it leads to a solitary beach paradise, a tropical bliss - excited and intrigued, he sets out to find it.",18.713,3551,6.4,en,"Drama, Adventure, Romance, Thriller",https://image.tmdb.org/t/p/original/mlDgFjQE5f7nOJV9VLbo661hlbA.jpg,tt0163978,Leonardo DiCaprio|Guillaume Canet|Tilda Swinton|Virginie Ledoyen|Staffan Kihlbom,Danny Boyle,119,,
11/2/2000,The Tigger Movie,"As it happens, everybody - Pooh, Piglet, Eeyore, Roo, Rabbit, Owl - is busy preparing a suitable winter home for Eeyore. When everything they do seems to get undone by Tigger's exuberant bouncing, Rabbit suggest Tigger go outside and find other tiggers to bounce with - a notion Tigger finds ridiculous because, after all, he's ""the onliest one"" Or is he?",24.431,441,6.5,en,"Family, Animation, Comedy",https://image.tmdb.org/t/p/original/lxuiGvLHIL1ZyePP7bn6FcKj0Mr.jpg,tt0220099,Jim Cummings|Nikita Hopkins|Ken Sansom|John Fiedler|Peter Cullen,Jun Falkenstein,77,,
16/02/2000,Hanging Up,"A trio of sisters bond over their ambivalence toward the approaching death of their curmudgeonly father, to whom none of them was particularly close.",14.493,137,5.3,en,"Drama, Comedy",https://image.tmdb.org/t/p/original/lnnFFGhIXi6ZDU3r29eKHKTHdq0.jpg,tt0162983,Meg Ryan|Diane Keaton|Lisa Kudrow|Walter Matthau|Adam Arkin,Diane Keaton,94,,
18/02/2000,The Whole Nine Yards,"A mobster named Jimmy the Tulip agrees to cooperate with an FBI investigation in order to stay out of prison; he's relocated by the authorities to a life of suburban anonymity as part of a witness protection program. It's not long before a couple of his new neighbors figure out his true identity and come knocking to see if he'd be up for one more hit, suburban style.",16.774,1433,6.4,en,"Comedy, Crime",https://image.tmdb.org/t/p/original/r4FvRHW1J9FAOnCYchZ7QanQ04e.jpg,tt0190138,Bruce Willis|Matthew Perry|Rosanna Arquette|Michael Clarke Duncan|Kevin Pollak,Jonathan Lynn,98,,
25/02/2000,Reindeer Games,"After assuming his dead cellmate's identity to get with his girlfriend, an ex-con finds himself the reluctant participant in a casino heist.",17.846,496,5.6,en,"Thriller, Action, Crime, Drama",https://image.tmdb.org/t/p/original/8y1PedfYWllJVoBbkt9KWLY155v.jpg,tt0184858,Ben Affleck|Gary Sinise|Charlize Theron|Dennis Farina|Donal Logue,John Frankenheimer,124,,
22/02/2000,Wonder Boys,"Grady (Michael Douglas) is a 50-ish English professor who hasn't had a thing published in years -- not since he wrote his award winning ""Great American Novel"" 7 years ago. This weekend proves even worse than he could imagine as he finds himself reeling from one misadventure to another in the company of a new wonder boy author.",13.797,456,6.9,en,"Comedy, Drama",https://image.tmdb.org/t/p/original/vGOdSLaZmu42qqwDUMgrfctJ65M.jpg,tt0185014,Michael Douglas|Tobey Maguire|Frances McDormand|Katie Holmes|Rip Torn,Curtis Hanson,111,,
10/10/1961,Splendor in the Grass,A fragile Kansas girl's unrequited and forbidden love for a handsome young man from the town's most powerful family drives her to heartbreak and madness.,15.552,193,7.6,en,"Drama, Romance",https://image.tmdb.org/t/p/original/jlTxlgUAgX899ltiWPf3ek6lAaF.jpg,tt0055471,Natalie Wood|Warren Beatty|Pat Hingle|Audrey Christie|Barbara Loden,Elia Kazan,124,,
10/3/2000,Mission to Mars,"When contact is lost with the crew of the first Mars expedition, a rescue mission is launched to discover their fate.",15.89,1089,6,en,"Science Fiction, Thriller",https://image.tmdb.org/t/p/original/6bOaiFQZsBEjUZWGPUv3s9pdvhu.jpg,tt0183523,Gary Sinise|Tim Robbins|Don Cheadle|Connie Nielsen|Jerry O'Connell,Brian De Palma,114,,
25/08/1999,The Ninth Gate,"An all-expenses-paid international search for a rare copy of the book, 'The Nine Gates of the Shadow Kingdom' brings an unscrupulous book dealer deep into a world of murder, double-dealing and satanic worship.",22.485,2277,6.4,en,"Mystery, Thriller",https://image.tmdb.org/t/p/original/rxw9l9YNL14ODdmAavUwHLBjiDo.jpg,tt0142688,Johnny Depp|Frank Langella|Lena Olin|Emmanuelle Seigner|Barbara Jefford,Roman Polanski,133,,
1/8/1973,American Graffiti,A couple of high school graduates spend one final night cruising the strip with their buddies before they go off to college.,13.474,1067,7.1,en,"Comedy, Drama",https://image.tmdb.org/t/p/original/1yFdtOV0b9UBUoBNbw0ZcyLbadk.jpg,tt0069704,Richard Dreyfuss|Ron Howard|Paul Le Mat|Charles Martin Smith|Cindy Williams,George Lucas,110,,
25/06/1969,The Bridge at Remagen,"In March of 1945, as the War in Europe is coming to a close, fighting erupts between German and American troops at the last remaining bridgehead across the Rhine.",14.068,104,6.6,en,"History, War, Action",https://image.tmdb.org/t/p/original/d8kKzYlzTK73PVvEUJsUfc3VRUH.jpg,tt0064110,George Segal|Ben Gazzara|Robert Vaughn|Bradford Dillman|Peter van Eyck,John Guillermin,117,,
20/12/1991,JFK,New Orleans District Attorney Jim Garrison discovers there's more to the Kennedy assassination than the official story.,21.337,1571,7.6,en,"Drama, Thriller, History",https://image.tmdb.org/t/p/original/r0VWVTYlqdRCK5ZoOdNnHdqM2gt.jpg,tt0102138,Kevin Costner|Tommy Lee Jones|Gary Oldman|Kevin Bacon|Michael Rooker,Oliver Stone,189,,
3/2/1989,Who's Harry Crumb?,Harry Crumb is a bumbling and inept private investigator who is hired to solve the kidnapping of a young heiress which he's not expected to solve because his employer is the mastermind behind the kidnapping.,15.485,222,5.7,en,"Comedy, Crime, Mystery",https://image.tmdb.org/t/p/original/6cLX9c12I6X1Fmg8y7fN3AFwDWF.jpg,tt0098645,John Candy|Jeffrey Jones|Annie Potts|Tim Thomerson|Barry Corbin,Paul Flaherty,94,,
5/6/1987,Harry and the Hendersons,"Returning from a hunting trip in the forest, the Henderson family's car hits an animal in the road. At first they fear it was a man, but when they examine the ""body"" they find it's a ""bigfoot"". They think it's dead so they decide to take it home (there could be some money in this). As you guessed, it isn't dead. Far from being the ferocious monster they fear ""Harry"" to be, he's a friendly giant.",18.772,541,6.1,en,"Comedy, Family, Fantasy",https://image.tmdb.org/t/p/original/5ZNWhOEsuNHIQ1gbtwdTGK7srCr.jpg,tt0093148,John Lithgow|Melinda Dillon|Margaret Langrick|Joshua Rudoy|Kevin Peter Hall,William Dear,110,,
8/12/1989,She-Devil,A cunning and resourceful housewife vows revenge on her husband when he begins an affair with a wealthy romance novelist.,14.045,295,5.9,en,Comedy,https://image.tmdb.org/t/p/original/jWYAXtdYF804aT1muO0G6FuR2Fa.jpg,tt0098309,Meryl Streep|Ed Begley Jr.|Linda Hunt|Roseanne Barr|Sylvia Miles,Susan Seidelman,99,,
27/03/1987,Blind Date,"When bachelor Walter Davis (Bruce Willis) is set up with his sister-in-law's pretty cousin, Nadia Gates (Kim Basinger), a seemingly average blind date turns into a chaotic night on the town. Walter's brother, Ted (Phil Hartman), tells him not to let Nadia drink alcohol, but he dismisses the warning, and her behavior gets increasingly wild. Walter and Nadia's numerous incidents are made even worse as her former lover David (John Larroquette) relentlessly follows them around town.",14.092,353,6,en,"Comedy, Romance",https://image.tmdb.org/t/p/original/cLb3akSpZhU5qkmCO46IHfJtcs0.jpg,tt0092666,Kim Basinger|Bruce Willis|John Larroquette|William Daniels|George Coe,Blake Edwards,95,,
24/11/1993,We're Back! A Dinosaur's Story,"Captain New Eyes travels back in time and feeds dinosaurs his Brain Grain cereal, which makes them intelligent and non-violent. They agree to go to the Middle Future in order to grant the wishes of children in New York city. They are to meet Dr. Bleeb of the Museum of Natural History, but get sidetracked with their new children friends and run into the Captain's evil brother, Professor",21.844,324,6,en,"Animation, Science Fiction, Family",https://image.tmdb.org/t/p/original/iyFmhYlioe3PDZjSKWtcIhu5R02.jpg,tt0108526,John Goodman|Jay Leno|Walter Cronkite|Blaze Berdahl|Rhea Perlman,Phil Nibbelink|Simon Wells|Dick Zondag|Ralph Zondag,64,,
17/03/2000,Erin Brockovich,"A twice-divorced mother of three who sees an injustice, takes on the bad guy and wins -- with a little help from her push-up bra. Erin goes to work for an attorney and comes across medical records describing illnesses clustered in one nearby town. She starts investigating and soon exposes a monumental cover-up.",28.624,2449,7.4,en,Drama,https://image.tmdb.org/t/p/original/xbMEHLu36LyptPD29FxVTndpYZ1.jpg,tt0195685,Julia Roberts|Albert Finney|Aaron Eckhart|Marg Helgenberger|Cherry Jones,Steven Soderbergh,131,,
17/03/2000,Final Destination,"After a teenager has a terrifying vision of him and his friends dying in a plane crash, he prevents the accident only to have Death hunt them down, one by one.",60.43,4288,6.5,en,Horror,https://image.tmdb.org/t/p/original/g4dkGtWdc1eQ9JL1kta6LC0DlGS.jpg,tt0195714,Devon Sawa|Ali Larter|Kerr Smith|Tony Todd|Seann William Scott,James Wong,98,,
24/05/1991,Thelma & Louise,"Whilst on a short weekend getaway, Louise shoots a man who had tried to rape Thelma. Due to the incriminating circumstances, they make a run for it and thus a cross country chase ensues for the two fugitives. Along the way, both women rediscover the strength of their friendship and surprising aspects of their personalities and self-strengths in the trying times.",20.323,2545,7.6,en,"Drama, Thriller, Crime, Adventure",https://image.tmdb.org/t/p/original/vbRAGLzbC75QfiKD1lKjmnQGuph.jpg,tt0103074,Susan Sarandon|Geena Davis|Harvey Keitel|Brad Pitt|Michael Madsen,Ridley Scott,130,,
19/10/1979,...And Justice for All,"An ethical Baltimore defense lawyer disgusted with rampant legal corruption is asked to defend a judge he despises in a rape trial. But if he doesn't do it, the judge will have him disbarred.",18.343,350,7.1,en,"Crime, Drama, Thriller",https://image.tmdb.org/t/p/original/AiAXiqN883MYQMzxeEzAtV9jkU0.jpg,tt0078718,Al Pacino|Jack Warden|John Forsythe|Christine Lahti|Lee Strasberg,Norman Jewison,119,,
27/07/1978,Animal House,"At a 1962 College, Dean Vernon Wormer is determined to expel the entire Delta Tau Chi Fraternity, but those troublemakers have other plans for him.",19.854,1180,7,en,Comedy,https://image.tmdb.org/t/p/original/fWooBbipMRIKeSRhEzmeaDV0T8H.jpg,tt0077975,John Belushi|Tim Matheson|John Vernon|Verna Bloom|Tom Hulce,John Landis,109,,
24/07/1974,Death Wish,A New York City architect becomes a one-man vigilante squad after his wife is murdered by street punks in which he randomly goes out and kills would-be muggers on the mean streets after dark.,17.548,575,6.9,en,Action,https://image.tmdb.org/t/p/original/n0MJPBLSCtt7DBYZGFsOfQkZCWt.jpg,tt0071402,Charles Bronson|Hope Lange|Vincent Gardenia|Steven Keats|William Redfield,Michael Winner,93,,
1/11/1985,Death Wish 3,"Paul Kersey returns to New York to visit his friend Charley, who lives in one of the worst parts of New York City. But when Paul arrives at Charley's apartment, he finds Charley dying after a vicious beating by a gang led by Manny Fraker, and the police enter the apartment and find Paul standing over Charley's body. Paul is arrested for the murder, but police chief Richard S. Shriker is like Paul.",15.564,289,6.2,en,Action,https://image.tmdb.org/t/p/original/5NW09xV5sZCHVkVdTP1BilW2CCq.jpg,tt0089003,Charles Bronson|Deborah Raffin|Ed Lauter|Martin Balsam|Gavin O'Herlihy,Michael Winner,92,,
11/6/1987,Death Wish 4: The Crackdown,"After the death of his girlfriend's daughter from a drug overdose, Paul Kersey (Charles Bronson) takes on the local drug cartel.",14.726,204,5.7,en,Action,https://image.tmdb.org/t/p/original/iTknCjGmcVMLCvbAVyhHrFNDP2D.jpg,tt0092857,Charles Bronson|Kay Lenz|John P. Ryan|Perry Lopez|George Dickerson,J. Lee Thompson,99,,
22/03/1991,Teenage Mutant Ninja Turtles II: The Secret of the Ooze,"The Turtles and the Shredder battle once again, this time for the last cannister of the ooze that created the Turtles, which Shredder wants to create an army of new mutants.",20.886,820,6.1,en,"Science Fiction, Adventure, Action, Comedy, Family",https://image.tmdb.org/t/p/original/Hyvvz9Z3le1is8a0EeFJQm0aSC.jpg,tt0103060,Paige Turco|David Warner|Michelan Sisti|Leif Tilden|Kenn Scott,Michael Pressman,88,,
17/03/1993,Teenage Mutant Ninja Turtles III,"The four turtles travel back in time to the days of the legendary and deadly samurai in ancient Japan, where they train to perfect the art of becoming one. The turtles also assist a small village in an uprising.",20.029,589,5.4,en,"Action, Adventure, Comedy, Family, Fantasy, Science Fiction",https://image.tmdb.org/t/p/original/fwX5RdPDBFsbEAXc46DrvRz5Bca.jpg,tt0108308,Paige Turco|Stuart Wilson|Sab Shimono|Vivian Wu|Mark Caso,Stuart Gillard,96,,
