release_date,title,overview,popularity,vote_count,vote_average,original_language,genre,poster_url,imdb_id,cast,director,runtime
28/06/2002,Mr. Deeds,"When Longfellow Deeds, a small-town pizzeria owner and poet, inherits $40 billion from his deceased uncle, he quickly begins rolling in a different kind of dough. Moving to the big city, Deeds finds himself besieged by opportunists all gunning for their piece of the pie. Babe, a television tabloid reporter, poses as an innocent small-town girl to do an exposé on Deeds.",19.703,1775,5.8,en,"Comedy, Romance",https://image.tmdb.org/t/p/original/pX0oAJ27acWEHoI7lmmQpoBmdv4.jpg,tt0280590,Adam Sandler|Winona Ryder|John Turturro|Allen Covert|Peter Gallagher,Steven Brill,96,,
5/11/1993,Look Who's Talking Now!,"When Samantha LeBon hatches a scheme to spend a romantic Christmas with her new employee -- the unsuspecting, blithesome James -- his wife, their kids and their two dogs, Rocks and Daphne, must rescue him before he makes a terrible mistake.",20.016,808,5.4,en,"Romance, Comedy, Family",https://image.tmdb.org/t/p/original/73JahFiizkMVsrrslXInmNK54nC.jpg,tt0107438,John Travolta|Kirstie Alley|Lysette Anthony|Diane Keaton|Danny DeVito,Tom Ropelewski,96,,
3/7/2002,Like Mike,"Calvin and his friends, who all live in an orphanage, find old shoes with the faded letters MJ connected to a powerline. One stormy night, they go to get the shoes when Calvin and the shoes are struck by lightning. Calvin now has unbelievable basketball powers and has the chance to play for the NBA.",16.441,386,6.1,en,"Comedy, Family, Fantasy",https://image.tmdb.org/t/p/original/z5YVuiPhi1UGjAzm9EeNfhbjiy0.jpg,tt0308506,Shad Moss|Morris Chestnut|Jonathan Lipnicki|Brenda Song|Jesse Plemons,John Schultz,99,,
3/7/2002,Men in Black II,"Kay and Jay reunite to provide our best, last and only line of defense against a sinister seductress who levels the toughest challenge yet to the MIB's untarnished mission statement – protecting Earth from the scum of the universe. It's been four years since the alien-seeking agents averted an intergalactic disaster of epic proportions. Now it's a race against the clock as Jay must convince Kay – who not only has absolutely no memory of his time spent with the MIB, but is also the only living person left with the expertise to save the galaxy – to reunite with the MIB before the earth submits to ultimate destruction.",41.014,8237,6.3,en,"Action, Adventure, Comedy, Science Fiction",https://image.tmdb.org/t/p/original/enA22EPyzc2WQ1VVyY7zxresQQr.jpg,tt0120912,Tommy Lee Jones|Will Smith|Rip Torn|Lara Flynn Boyle|Johnny Knoxville,Barry Sonnenfeld,88,,
12/7/2002,Reign of Fire,"In post-apocalyptic England, an American volunteer and a British survivor team up to fight off a brood of fire-breathing dragons seeking to return to global dominance after centuries of rest underground. The Brit -- leading a clan of survivors to hunt down the King of the Dragons -- has much at stake: His mother was killed by a dragon, but his love is still alive.",18.723,1749,6.1,en,"Adventure, Action, Fantasy",https://image.tmdb.org/t/p/original/vZVXCj3jXzIPJUHLaQohzt2uTM3.jpg,tt0253556,Christian Bale|Matthew McConaughey|Izabella Scorupco|Gerard Butler|Alexander Siddig,Rob Bowman,101,,
12/7/2002,Road to Perdition,"Mike Sullivan works as a hit man for crime boss John Rooney. Sullivan views Rooney as a father figure, however after his son is witness to a killing, Mike Sullivan finds himself on the run in attempt to save the life of his son and at the same time looking for revenge on those who wronged him.",20.62,2835,7.4,en,"Crime, Drama, Thriller",https://image.tmdb.org/t/p/original/4jeoPpAtyPWMavXRPSrMYhy3BpK.jpg,tt0257044,Tom Hanks|Tyler Hoechlin|Jennifer Jason Leigh|Liam Aiken|Paul Newman,Sam Mendes,117,,
1/7/2002,Halloween: Resurrection,"Serial Killer Michael Myers is not finished with Laurie Strode, and their rivalry finally comes to an end. But is this the last we see of Myers? Freddie Harris and Nora Winston are reality programmers at DangerTainment, and are planning to send a group of 6 thrill-seeking teenagers into the childhood home of Myers. Cameras are placed all over the house and no one can get out of the house... and then Michael arrives home!",28.949,924,4.6,en,"Horror, Thriller",https://image.tmdb.org/t/p/original/iIc41W2AViZWasmvWEHOTiW8lym.jpg,tt0220506,Jamie Lee Curtis|Brad Loree|Busta Rhymes|Bianca Kajlich|Katee Sackhoff,Rick Rosenthal,94,,
17/07/2002,Eight Legged Freaks,"The residents of a rural mining town discover that an unfortunate chemical spill has caused hundreds of little spiders to mutate overnight to the size of SUVs. It's then up to mining engineer Chris McCormack and Sheriff Sam Parker to mobilize an eclectic group of townspeople, including the Sheriff's young son, Mike, her daughter, Ashley, and paranoid radio announcer Harlan, into battle against the bloodthirsty eight-legged beasts.",23.74,918,5.7,en,"Action, Comedy, Horror, Thriller",https://image.tmdb.org/t/p/original/1hf7x6WmyXtL1MlY4eSlTbZ8Nzu.jpg,tt0271367,David Arquette|Kari Wuhrer|Scott Terra|Scarlett Johansson|Doug E. Doug,Ellory Elkayem,99,,
19/07/2002,K-19: The Widowmaker,"When Russia's first nuclear submarine malfunctions on its maiden voyage, the crew must race to save the ship and prevent a nuclear disaster.",15.446,738,6.4,en,"Drama, History, War, Thriller, Mystery",https://image.tmdb.org/t/p/original/ojUbKgXLeGr67XCuGVfU9KZh2rg.jpg,tt0267626,Harrison Ford|Liam Neeson|Peter Sarsgaard|Joss Ackland|John Shrapnel,Kathryn Bigelow,138,,
19/07/2002,Stuart Little 2,"Stuart, an adorable white mouse, still lives happily with his adoptive family, the Littles, on the east side of Manhattan's Central Park. More crazy mouse adventures are in store as Stuart, his human brother, George, and their mischievous cat, Snowbell, set out to rescue a friend.",40.728,1969,5.7,en,"Family, Adventure, Animation, Comedy",https://image.tmdb.org/t/p/original/hjfeMLWqJY44mqqJKZSa6jx4Y1j.jpg,tt0243585,Michael J. Fox|Geena Davis|Hugh Laurie|Jonathan Lipnicki|Anna Hoelck,Rob Minkoff,78,,
8/6/1984,Top Secret!,"Popular and dashing American singer Nick Rivers travels to East Germany to perform in a music festival. When he loses his heart to the gorgeous Hillary Flammond, he finds himself caught up in an underground resistance movement. Rivers joins forces with Agent Cedric and Flammond to attempt the rescue of her father, Dr. Paul, from the Germans, who have captured the scientist in hopes of coercing him into building a new naval mine.",30.156,825,7.1,en,Comedy,https://image.tmdb.org/t/p/original/xsuEGorx2RcgtF6JKQjwYYrcr3E.jpg,tt0088286,Val Kilmer|Lucy Gutteridge|Peter Cushing|Jeremy Kemp|Christopher Villiers,Jim Abrahams|David Zucker|Jerry Zucker,90,,
9/8/2002,Blood Work,"Still recovering from a heart transplant, a retired FBI profiler returns to service when his own blood analysis offers clues to the identity of a serial killer.",14.291,590,6.1,en,"Crime, Thriller",https://image.tmdb.org/t/p/original/A6wWJkIREagRWFNu3YotID3n9aW.jpg,tt0309377,Clint Eastwood|Jeff Daniels|Anjelica Huston|Wanda De Jesus|Tina Lifford,Clint Eastwood,110,,
9/8/2002,xXx,"Xander Cage is your standard adrenaline junkie with no fear and a lousy attitude. When the US Government ""recruits"" him to go on a mission, he's not exactly thrilled. His mission: to gather information on an organization that may just be planning the destruction of the world, led by the nihilistic Yorgi.",33.986,3427,5.9,en,"Action, Adventure, Thriller",https://image.tmdb.org/t/p/original/86BnliVDBo2TjKmrgQTJIPHxAKd.jpg,tt0295701,Vin Diesel|Asia Argento|Marton Csokas|Samuel L. Jackson|Michael Roof,Rob Cohen,124,,
18/09/1987,The Principal,"Burglary. Drugs. Assault. Rape. The students at Brandel High are more than new Principal Rick Latimer bargained for. Gangs fight to control the school using knives - even guns - when they have to. When Latimer and the head of security try to clean up the school and stop the narcotics trade, they run up against a teenage mafia. A violent confrontation on the campus leads to a deadly showdown with the drug dealer's gang, and one last chance for Latimer to save his career... and his life.",15.413,200,6.5,en,"Action, Adventure, Crime, Drama",https://image.tmdb.org/t/p/original/kwwDruwoHwNMY6tV7KOdVGcEusT.jpg,tt0093780,"Jim Belushi|Louis Gossett, Jr.|Rae Dawn Chong|Michael Wright|J.J. Cohen",Christopher Cain,109,,
8/8/2002,Blue Crush,"Nothing gets between Anne Marie and her board. Living in a beach shack with three roommates, she is up before dawn every morning to conquer the waves and count the days until the Pipe Masters competition. Having transplanted herself to Hawaii with no one's blessing but her own, Anne Marie finds all she needs in the adrenaline-charged surf scene - until pro quarterback Matt Tollman comes along...",14.337,433,6,en,"Adventure, Romance, Drama",https://image.tmdb.org/t/p/original/iZSw0JVG0cIFuZoTHuQU3nmGT4k.jpg,tt0300532,Kate Bosworth|Matthew Davis|Michelle Rodriguez|Sanoe Lake|Mika Boorem,John Stockwell,104,,
17/07/2002,Undisputed,"Monroe Hutchens is the heavyweight champion of Sweetwater, a maximum security prison. He was convicted to a life sentence due to a passionate crime. Iceman Chambers is the heavyweight champion, who lost his title due to a rape conviction to ten years in Sweetwater. WHen these two giants collide in the same prison, they fight against each other disputing who is the real champion.",50.314,526,6.5,en,"Action, Adventure, Drama, Thriller",https://image.tmdb.org/t/p/original/xgnCABtbMDaDqn9bt3ZFJTnpA3e.jpg,tt0281322,Wesley Snipes|Ving Rhames|Peter Falk|Michael Rooker|Jon Seda,Walter Hill,96,,
31/07/1991,Hot Shots!,"Charlie Sheen, Lloyd Bridges, Cary Elwes, Valeria Golino and Jon Cryer co-star in director Jim Abrahams' (Airplane, Naked Gun) truly hilarious spoof of Top Gun. Recruited to join a top-secret mission for the Air Force, a renegade pilot (Sheen) finds himself coping with an incompetent admiral (Bridges) and a carefully selected squadron of flyers who are either inept or half-blind.",24.955,1629,6.5,en,"Action, Comedy, War",https://image.tmdb.org/t/p/original/hoPS7RSvdZhZhWf28OfP2IZ0cb3.jpg,tt0102059,Charlie Sheen|Cary Elwes|Valeria Golino|Lloyd Bridges|Kevin Dunn,Jim Abrahams,84,,
1/4/2002,Barbershop,"A day in the life of a barbershop on the south side of Chicago. Calvin, who inherited the struggling business from his deceased father, views the shop as nothing but a burden and waste of his time. After selling the shop to a local loan shark, Calvin slowly begins to see his father's vision and legacy and struggles with the notion that he just sold it out.",18.293,354,6.3,en,"Comedy, Drama",https://image.tmdb.org/t/p/original/up8cEgEsl2Dq5Djb9lMZYBK0s84.jpg,tt0303714,Ice Cube|Anthony Anderson|Cedric the Entertainer|Sean Patrick Thomas|Eve,Tim Story,102,,
10/3/2006,The Hills Have Eyes,"On the way to California, a family has the misfortune to have their car break down in an area closed to the public, and inhabited by violent savages ready to attack.",47.613,2289,6.4,en,"Horror, Thriller",https://image.tmdb.org/t/p/original/qj4C2c96T1n3YnYxFG5l5bSTKbM.jpg,tt0077681,Martin Speer|Russ Grieve|John Steadman|James Whitworth|Virginia Vincent,Wes Craven,89,,
22/07/1977,The Hills Have Eyes,"On the way to California, a family has the misfortune to have their car break down in an area closed to the public, and inhabited by violent savages ready to attack.",16.422,628,6.2,en,"Horror, Thriller",https://image.tmdb.org/t/p/original/1G2DBIEkoS0JdCiOFIeR3mD8ROE.jpg,tt0077681,Martin Speer|Russ Grieve|John Steadman|James Whitworth|Virginia Vincent,Wes Craven,89,,
13/07/1979,The Wanderers,The streets of the Bronx are owned by 60’s youth gangs where the joy and pain of adolescence is lived. Philip Kaufman tells his take on the novel by Richard Price about the history of the Italian-American gang ‘The Wanderers.’,13.845,134,7.1,en,Drama,https://image.tmdb.org/t/p/original/oedFtX9hZZWpD7L5wkD0WxSteY2.jpg,tt0080117,Ken Wahl|John Friedrich|Karen Allen|Toni Kalem|Alan Rosenberg,Philip Kaufman,117,,
8/9/2002,The Four Feathers,"The story, set in 1875, follows a British officer (Heath Ledger) who resigns his post when he learns of his regiment's plan to ship out to the Sudan for the conflict with the Mahdi. His friends and fiancée send him four white feathers which symbolize cowardice. To redeem his honor he disguises himself as an Arab and secretly saves the lives of those who branded him a coward.",14.366,432,6.6,en,"War, Drama, Romance, Action, Adventure",https://image.tmdb.org/t/p/original/jE5Fdoq2xZqfNEptdSXMJr1uN8x.jpg,tt0240510,Heath Ledger|Wes Bentley|Kate Hudson|Djimon Hounsou|Michael Sheen,Shekhar Kapur,132,,
20/09/2002,Secretary,"A young woman, recently released from a mental hospital, gets a job as a secretary to a demanding lawyer, where their employer-employee relationship turns into a sexual, sadomasochistic one.",28.871,1187,6.8,en,"Comedy, Drama, Romance",https://image.tmdb.org/t/p/original/mdRXSE7ho185SZlXj0JSwuecEd3.jpg,tt0274812,James Spader|Maggie Gyllenhaal|Jeremy Davies|Lesley Ann Warren|Stephen McHattie,Steven Shainberg,104,,
26/09/2002,Sweet Home Alabama,"New York fashion designer Melanie Carmichael suddenly finds herself engaged to the city's most eligible bachelor. But Melanie's past holds many secrets, including Jake, the redneck husband she married in high school, who refuses to divorce her. Bound and determined to end their contentious relationship once and for all, Melanie sneaks back home to Alabama to confront her past.",19.81,1223,6.4,en,"Comedy, Romance",https://image.tmdb.org/t/p/original/698cbxq0SRwCdOPG5Bwi7JDk12d.jpg,tt0256415,Reese Witherspoon|Josh Lucas|Patrick Dempsey|Candice Bergen|Rhona Mitra,Andy Tennant,108,,
27/09/2002,The Tuxedo,"Cabbie-turned-chauffeur Jimmy Tong learns there is really only one rule when you work for playboy millionaire Clark Devlin : Never touch Devlin's prized tuxedo. But when Devlin is temporarily put out of commission in an explosive accident, Jimmy puts on the tux and soon discovers that this extraordinary suit may be more black belt than black tie. Paired with a partner as inexperienced as he is, Jimmy becomes an unwitting secret agent.",21.798,1524,5.7,en,"Thriller, Action, Comedy, Science Fiction",https://image.tmdb.org/t/p/original/2agrcNQRtgTsN5SbffC4H2BwYW2.jpg,tt0290095,Jackie Chan|Jennifer Love Hewitt|Jason Isaacs|Debi Mazar|Ritchie Coster,Kevin Donovan,98,,
7/9/2001,Knockaround Guys,Four sons of well-known New York mobsters must retrieve a bag of cash from a small Montana town ruled by a corrupt sheriff.,20.144,253,5.9,en,"Crime, Thriller",https://image.tmdb.org/t/p/original/oYqsIxxIfJMRHiNEMLzgG81brkY.jpg,tt0211465,Barry Pepper|Andy Davoli|Seth Green|Vin Diesel|John Malkovich,Brian Koppelman|David Levien,92,,
11/10/2002,Tuck Everlasting,"Natalie Babbitt's award winning book for children comes to the screen in a lavish adaptation from Walt Disney Pictures. Winnie Foster (Alexis Bledel) is a girl in her early teens growing up in the small rural town of Winesap in 1914. Winnie's parents (Victor Garber and Amy Irving) are loving but overprotective, and Winnie longs for a life of greater freedom and adventure.",14.627,382,6.6,en,"Drama, Family, Fantasy, Romance",https://image.tmdb.org/t/p/original/9BXAC4uTHuD37hpiGOmhetqNgnO.jpg,tt0283084,Alexis Bledel|William Hurt|Sissy Spacek|Jonathan Jackson|Scott Bairstow,Jay Russell,90,,
11/10/2002,White Oleander,A teenager journeys through a series of foster homes after her mother goes to prison for committing a crime of passion.,14.025,291,7.1,en,Drama,https://image.tmdb.org/t/p/original/oGJDrJ9gMSs87iwE0sRZrG6EBhf.jpg,tt0283139,Alison Lohman|Michelle Pfeiffer|Cole Hauser|Robin Wright|Amy Aquino,Peter Kosminsky,109,,
9/10/2002,Bowling for Columbine,"Why do 11,000 people die in America each year at the hands of gun violence? Talking heads yelling from every TV camera blame everything from Satan to video games. But are we that much different from many other countries? What sets us apart? How have we become both the master and victim of such enormous amounts of violence? This is not a film about gun control. It is a film about the fearful heart and soul of the United States, and the 280 million Americans lucky enough to have the right to a constitutionally protected Uzi. From a look at the Columbine High School security camera tapes to the home of Oscar-winning NRA President Charlton Heston, from a young man who makes homemade napalm with The Anarchist's Cookbook to the murder of a six-year-old girl by another six-year-old, Bowling for Columbine is a journey through America, through our past, hoping to discover why our pursuit of happiness is so riddled with violence.",13.812,1213,7.6,en,Documentary,https://image.tmdb.org/t/p/original/nSoLDNbNraDszBT0gT2U0Azqof8.jpg,tt0310793,Michael Moore|George H. W. Bush|George W. Bush|Dick Clark|Charlton Heston,Michael Moore,120,,
18/10/2002,The Ring,"It sounded like just another urban legend: A videotape filled with nightmarish images, leading to a phone call foretelling the viewer's death in exactly seven days. As a newspaper reporter, Rachel Keller was naturally skeptical of the story, until four teenagers all met with mysterious deaths exactly one week after watching just such a tape. Allowing her investigative curiosity to get the better of her, Rachel tracks down the video... and watches it. Now she has just seven days to unravel the mystery of the Ring.",40.723,4954,6.6,en,"Horror, Mystery",https://image.tmdb.org/t/p/original/gghD2ZIPjMzLnnBuT3AZQGYnIW9.jpg,tt0298130,Naomi Watts|Martin Henderson|David Dorfman|Brian Cox|Shannon Cochran,Gore Verbinski,115,,
18/10/2002,Auto Focus,"A successful TV star during the 1960s, former ""Hogan's Heroes"" actor Bob Crane projects a wholesome family-man image, but this front masks his persona as a sex addict who records and photographs his many encounters with women, often with the help of his seedy friend, John Henry Carpenter. This biographical drama reveals how Crane's double life takes its toll on him and his family, and ultimately contributes to his death",13.75,136,6.4,en,"Crime, Drama",https://image.tmdb.org/t/p/original/rgXN6YTZ0qvgVyZhojEtUwJDH0B.jpg,tt0298744,Greg Kinnear|Willem Dafoe|Rita Wilson|Maria Bello|Ron Leibman,Paul Schrader,104,,
13/08/1993,Jason Goes to Hell: The Final Friday,"Jason Voorhees, the living, breathing essence of evil, is back for one fierce, final fling! Tracked down and blown to bits by a special FBI task force, everyone now assumes that he's finally dead. But everybody assumes wrong. Jason has been reborn with the bone-chilling ability to assume the identity of anyone he touches. The terrifying truth is that he could be anywhere, or anybody. In this shocking, blood-soaked finale to Jason's carnage-ridden reign of terror, the horrible secret of his unstoppable killing instinct is finally revealed.",41.336,690,4.5,en,Horror,https://image.tmdb.org/t/p/original/uZNsMWE5o1PaBEUjfRYaeZga08q.jpg,tt0107254,Kane Hodder|John D. LeMay|Kari Keegan|Steven Williams|Steven Culp,Adam Marcus,87,,
16/12/1977,Saturday Night Fever,"Tony Manero is a Brooklyn paint-store clerk who'd give anything to break out of his dead-end existence. In life, Tony is a peasant; on the disco dance floor, he's a king. As the soundtrack plays one Bee Gees hit after another, white-suited Tony struts his stuff amidst flashing lights and sweaty, undulating bodies. Tony's class aspirations are mirrored in his relationship with his dance partner, a secretary eager to move into the glamorous world of Manhattan.",19.313,1511,6.7,en,"Drama, Music",https://image.tmdb.org/t/p/original/ylA7E5Md21aqgzxbwa2dFxX8LKV.jpg,tt0076666,John Travolta|Karen Lynn Gorney|Barry Miller|Joseph Cali|Paul Pape,John Badham,118,,
11/7/1983,Staying Alive,It's five years later and Tony Manero's Saturday Night Fever is still burning. Now he's strutting toward his biggest challenger yet - making it as a dancer on the Broadway stage.,16.652,353,5.7,en,"Drama, Music",https://image.tmdb.org/t/p/original/4iie1EFRkM6ULQYUxRgghQ3AQRm.jpg,tt0086361,John Travolta|Cynthia Rhodes|Finola Hughes|Steve Inwood|Julie Bovasso,Sylvester Stallone,93,,
24/07/1981,Blow Out,"Jack Terry is a master sound recordist who works on grade-B horror movies. Late one evening, he is recording sounds for use in his movies when he hears something unexpected through his sound equipment and records it. Curiosity gets the better of him when the media become involved, and he begins to unravel the pieces of a nefarious conspiracy. As he struggles to survive against his shadowy enemies and expose the truth, he does not know whom he can trust.",15.697,987,7.3,en,"Thriller, Crime, Mystery",https://image.tmdb.org/t/p/original/weMW1wLzeagP3tw6BfmYf1iL7dz.jpg,tt0082085,John Travolta|Nancy Allen|John Lithgow|Dennis Franz|Peter Boyden,Brian De Palma,108,,
24/04/1981,Cannibal Ferox,"Three friends out to disprove cannibalism meet two men on the run who tortured and enslaved a cannibal tribe to find emeralds, and now the tribe is out for revenge.",18.185,183,5.4,it,"Adventure, Horror",https://image.tmdb.org/t/p/original/1Oa4NfUXM6bGr7hblzUqBSOKedb.jpg,tt0082700,Giovanni Lombardo Radice|Robert Kerman|Danilo Mattei|Venantino Venantini|Fiamma Maglione,Umberto Lenzi,93,,
30/09/1982,The Entity,"Barbara Hershey stars as Carla Moran, a hard-working single mother until the night she is raped in her bedroom by someone - or something - that she cannot see. Despite skeptical psychiatrists, she is repeatedly attacked in her car, in the bath, and in front of her children. Could this be a case of hysteria, a manifestation of childhood sexual trauma, or something even more horrific?",21.756,332,6.6,en,"Horror, Mystery, Thriller",https://image.tmdb.org/t/p/original/3gk2ZuC4OcyE9JYnv6f4FQAbH20.jpg,tt0082334,Barbara Hershey|Ron Silver|David Labiosa|George Coe|Margaret Blye,Sidney J. Furie,125,,
15/05/1981,Happy Birthday to Me,"Virginia is proud that she belongs to a clique. The best students at a private school. But before her 18th birthday, a grueling set of murders take place and her friends are the ones who are falling prey. Could it be her? She suffers from blackouts due to a freak accident one year earlier. We soon learn the truth behind her accident and what is going on...",14.958,119,6,en,"Drama, Horror, Thriller, Mystery",https://image.tmdb.org/t/p/original/yxGYpW43UzZuy4yvCP6Rzb5wyvS.jpg,tt0082498,Melissa Sue Anderson|Glenn Ford|Lawrence Dane|Sharon Acker|Frances Hyland,J. Lee Thompson,110,,
21/08/1981,Private Lessons,"Phillip Filmore is a naive, 15-year-old, preoccupied with sex, who develops a crush on Nicole Mallow, the new 30-something, French housekeeper and sitter to look after him when Phillip's father is out of town for the summer on a ""business"" trip. But Mr. Filmore's unscrupulous chauffeur, Lester Lewis, takes advantage of Phillip's crush on Nicole to hire her to seduce the youth, then draws her into a plot to fake her own death in a blackmail scheme aimed to drain Phillip's trust fund.",32.076,67,5.7,en,"Comedy, Romance",https://image.tmdb.org/t/p/original/dTkBOgOv3tpCnfMY6kX2MCYibo3.jpg,tt0082948,Sylvia Kristel|Howard Hesseman|Eric Brown|Meridith Baer|Pamela Jean Bryant,Alan Myerson,87,,
25/10/2002,Ghost Ship,"After discovering a passenger ship missing since 1962 floating adrift on the Bering Sea, salvagers claim the vessel as their own. Once they begin towing the ghost ship towards harbor, a series of bizarre occurrences happen and the group becomes trapped inside the ship, which they soon learn is inhabited by a demonic creature.",31.542,1843,5.9,en,"Horror, Mystery, Thriller",https://image.tmdb.org/t/p/original/fLb2tiGqUfVKdqo3BK9r0DIg9UH.jpg,tt0288477,Gabriel Byrne|Julianna Margulies|Desmond Harrington|Ron Eldard|Isaiah Washington,Steve Beck,91,,
25/10/2002,Jackass: The Movie,"Johnny Knoxville and his crazy friends appear on the big screen for the very first time in Jackass: The Movie. They wander around Japan in panda outfits, wreak havoc on a once civilized golf course, they even do stunts involving LIVE alligators, and so on. While Johnny Knoxvile and his pals put their life at risk, they are entertaining people at the same time. Get ready for Jackass: The Movie!!",30.705,1154,6.2,en,"Comedy, Action, Documentary",https://image.tmdb.org/t/p/original/9Rb659hvGfmef1xm0mMvDHEBqmf.jpg,tt0322802,Johnny Knoxville|Bam Margera|Steve-O|Chris Pontius|Dave England,Jeff Tremaine,87,,
31/10/2002,I Spy,"When the Switchblade, the most sophisticated prototype stealth fighter created yet, is stolen from the U.S. government, one of the United States' top spies, Alex Scott, is called to action. What he doesn't expect is to get teamed up with a cocky civilian, World Class Boxing Champion Kelly Robinson, on a dangerous top secret espionage mission. Their assignment: using equal parts skill and humor, catch Arnold Gundars, one of the world's most successful arms dealers.",21.259,766,5.4,en,"Action, Adventure, Comedy, Thriller",https://image.tmdb.org/t/p/original/zMgg3txKpggWtTlAkD8xpbbRRCI.jpg,tt0297181,Eddie Murphy|Owen Wilson|Famke Janssen|Keith Dallas|Malcolm McDowell,Betty Thomas,97,,
31/10/2002,The Santa Clause 2,"Better watch out! The big guy in red is coming to town once again. This time, Scott Calvin -- also known as Santa Claus -- finds out there's an obscure clause in his contract requiring him to take on a wife. He has to leave the North Pole to fulfill his obligations, or else he'll be forced to give up his Yuletide gig.",18.617,1003,5.9,en,"Fantasy, Comedy, Family",https://image.tmdb.org/t/p/original/g8snUzCS8JhRAzAxZUCAktEGU7d.jpg,tt0304669,Tim Allen|Elizabeth Mitchell|David Krumholtz|Eric Lloyd|Spencer Breslin,Michael Lembeck,104,,
