release_date,title,overview,popularity,vote_count,vote_average,original_language,genre,poster_url,imdb_id,cast,director,runtime
11/11/1997,Mortal Kombat: Annihilation,"A group of heroic warriors has only six days to save the planet in ""Mortal Kombat Annihilation."" To succeed they must survive the most spectacular series of challenges any human, or god, has ever encountered as they battle an evil warlord bent on taking control of Earth. Sequel to the film ""Mortal Kombat,"" and based on the popular video game.",28.196,885,4.5,en,"Action, Fantasy, Science Fiction",https://image.tmdb.org/t/p/original/ttryglcY2osWZE3sRYBf3ewTZsW.jpg,tt0119707,Robin Shou|Talisa Soto|James Remar|Sandra Hess|Lynn 'Red' Williams,John R. Leonetti,95,,
4/6/1998,The Truman Show,"Truman Burbank is the star of ""The Truman Show"", a 24-hour-a-day ""reality"" TV show that broadcasts every aspect of his life -- live and in color -- without his knowledge. His entire life has been an unending soap opera for consumption by the rest of the world. And everyone he knows -- including his wife and his best friend -- is really an actor, paid to be part of his life.",35.128,14393,8.1,en,"Comedy, Drama",https://image.tmdb.org/t/p/original/2rs16qtfuOuExq1vBtfmTUtRYFj.jpg,tt0120382,Jim Carrey|Laura Linney|Noah Emmerich|Natascha McElhone|Ed Harris,Peter Weir,103,,
30/10/1997,Red Corner,"An American attorney on business in China, ends up wrongfully on trial for murder and his only key to innocence is a female defense lawyer from the country.",14.026,262,6.2,en,"Crime, Drama, Thriller",https://image.tmdb.org/t/p/original/xsIbKOO1CacqTagyJmEGGf4kOnn.jpg,tt0119994,Richard Gere|Bai Ling|Bradley Whitford|Byron Mann|Peter Donat,Jon Avnet,122,,
14/11/1997,The Jackal,"Hired by a powerful member of the Russian mafia to avenge an FBI sting that left his brother dead, the perfectionist Jackal proves an elusive target for the men charged with the task of bringing him down: a deputy FBI boss and a former IRA terrorist.",20.902,1458,6.3,en,"Action, Thriller, Adventure, Crime",https://image.tmdb.org/t/p/original/wkLF73oenC1n1DDKKU7oyLKVcMa.jpg,tt0119395,Bruce Willis|Richard Gere|Sidney Poitier|Diane Venora|J.K. Simmons,Michael Caton-Jones,124,,
20/11/1997,Anastasia,"This animated adventure retells the story of the lost daughter of Russia's last czar. The evil Rasputin places a curse on the Romanov family, and Anastasia and her grandmother, Empress Maria, get separated. After growing up in an orphanage, Anastasia encounters two Russian men seeking a reward offered by Empress Maria for the return of her granddaughter. The trio travels to Paris, where they find that the empress has grown skeptical of imposters.",61.104,4533,7.6,en,"Animation, Family",https://image.tmdb.org/t/p/original/bppGWGA8zq1sRvTdDJnUzVW9GcH.jpg,tt0118617,Meg Ryan|John Cusack|Christopher Lloyd|Angela Lansbury|Hank Azaria,Don Bluth|Gary Goldman,94,,
1/10/2014,The Apostle,"After his happy life spins out of control, a preacher from Texas changes his name, goes to Louisiana and starts preaching on the radio.",20.437,10,6.4,fr,Drama,https://image.tmdb.org/t/p/original/lOCAXX85lQG2mZ5UEFHT7UhRfmW.jpg,tt0118632,Robert Duvall|Billy Bob Thornton|June Carter Cash|Farrah Fawcett|Miranda Richardson,Robert Duvall,134,,
26/11/1997,Flubber,"Professor Phillip Brainard, an absent minded professor, works with his assistant Weebo, trying to create a substance that's a new source of energy and that will save Medfield College where his sweetheart Sara is the president. He has missed his wedding twice, and on the afternoon of his third wedding, Professor Brainard creates flubber, which allows objects to fly through the air.",16.911,1904,5.6,en,"Comedy, Family, Science Fiction",https://image.tmdb.org/t/p/original/bnKvk04icAyCO1KjqhsaEXBO9aJ.jpg,tt0119137,Robin Williams|Marcia Gay Harden|Christopher McDonald|Raymond J. Barry|Clancy Brown,Les Mayfield,93,,
11/12/1997,For Richer or Poorer,"Brad Sexton and his wife, Caroline, are wealthy New Yorkers with both marital and financial problems. The latter issue becomes a pressing matter when they discover that their accountant has embezzled millions and pinned the blame on them. Forced to go on the lam, Brad and Caroline end up in an Amish area of Pennsylvania and decide to pose as members of the religious group to evade the IRS. As the two adapt to the simple Amish lifestyle, they begin to reconnect.",14.749,173,5.8,en,Comedy,https://image.tmdb.org/t/p/original/tPjqY9Qp5WOIBFKnyEpMBVwGr01.jpg,tt0119142,Tim Allen|Kirstie Alley|Wayne Knight|Larry Miller|Jay O. Sanders,Bryan Spicer,115,,
12/12/1997,Home Alone 3,"9-year-old Alex Pruitt is home alone with the chicken pox. Turns out, due to a mix-up among nefarious spies, Alex was given a toy car concealing a top-secret microchip. Now Alex must fend off the spies as they try break into his house to get it back.",47.907,2402,5.3,en,"Comedy, Family",https://image.tmdb.org/t/p/original/6uOadrCfle0n2LOOxHbgWEdnrm2.jpg,tt0119303,Alex D. Linz|Olek Krupa|Rya Kihlstedt|Lenny Von Dohlen|Scarlett Johansson,Raja Gosnell,102,,
19/12/1997,MouseHunt,"Down-on-their luck brothers, Lars and Ernie Smuntz, aren't happy with the crumbling old mansion they inherit... until they discover the estate is worth millions. Before they can cash in, they have to rid the house of it's single, stubborn occupant: a tiny and tenacious mouse.",26.346,985,6.5,en,"Comedy, Family",https://image.tmdb.org/t/p/original/aqBPrWOzXEO3rWEk3DYTHBjXNZb.jpg,tt0119715,Nathan Lane|Lee Evans|Vicki Lewis|Maury Chaykin|Eric Christmas,Gore Verbinski,98,,
9/12/1997,Scream 2,"Two years after the terrifying events that occurred in Woodsboro, Sidney is now attending Windsor College in Cincinnati, and Gale Weathers' best selling book on Sidney's life has now been made into a major motion picture. When two college students are killed in a theatre while watching the new film 'Stab', Sidney knows deep down that history is repeating itself.",63.675,2860,6.4,en,"Horror, Mystery",https://image.tmdb.org/t/p/original/dORlVasiaDkJXTqt9bdH7nFNs6C.jpg,tt0120082,David Arquette|Neve Campbell|Courteney Cox|Sarah Michelle Gellar|Jamie Kennedy,Wes Craven,120,,
18/11/1997,Titanic,"84 years later, a 101-year-old woman named Rose DeWitt Bukater tells the story to her granddaughter Lizzy Calvert, Brock Lovett, Lewis Bodine, Bobby Buell and Anatoly Mikailavich on the Keldysh about her life set in April 10th 1912, on a ship called Titanic when young Rose boards the departing ship with the upper-class passengers and her mother, Ruth DeWitt Bukater, and her fiancé, Caledon Hockley. Meanwhile, a drifter and artist named Jack Dawson and his best friend Fabrizio De Rossi win third-class tickets to the ship in a game. And she explains the whole story from departure until the death of Titanic on its first and last voyage April 15th, 1912 at 2:20 in the morning.",123.007,20674,7.9,en,"Drama, Romance",https://image.tmdb.org/t/p/original/9xjZS2rlVxm8SFx8kPC3aIGCOYQ.jpg,tt0120338,Kate Winslet|Leonardo DiCaprio|Frances Fisher|Billy Zane|Kathy Bates,James Cameron,194,,
11/12/1997,Tomorrow Never Dies,A deranged media mogul is staging international incidents to pit the world's superpowers against each other. Now 007 must take on this evil mastermind in an adrenaline-charged battle to end his reign of terror and prevent global pandemonium.,40.523,2390,6.3,en,"Adventure, Action, Thriller",https://image.tmdb.org/t/p/original/yWXNZHE4k4jlQhGhBEiLwYa2rIt.jpg,tt0120347,Pierce Brosnan|Jonathan Pryce|Michelle Yeoh|Teri Hatcher|Ricky Jay,Roger Spottiswoode,119,,
25/12/1997,The Postman,"In 2013 there are no highways, no I-ways, no dreams of a better tomorrow, only scattered survivors across what was once the Unites States. Into this apocalyptic wasteland comes an enigmatic drifter with a mule, a knack for Shakespeare and something yet undiscovered: the power to inspire hope.",13.654,805,6.2,en,"Science Fiction, Adventure, Action, War",https://image.tmdb.org/t/p/original/piVzOuKFLHNGLxnjwNtibC26lTy.jpg,tt0119925,Kevin Costner|Will Patton|Olivia Williams|Larenz Tate|Tom Petty,Kevin Costner,177,,
14/05/1998,The Horse Whisperer,"Based on the novel by the same name from Nicholas Evans, the talented Robert Redford presents this meditative family drama set in the country side. Redford not only directs but also stars in the roll of a cowboy with a magical talent for healing.",14.024,918,6.9,en,"Drama, Romance",https://image.tmdb.org/t/p/original/1Ptdh2fdA5xpH5Zj8AQUAp9Tdoa.jpg,tt0119314,Robert Redford|Kristin Scott Thomas|Sam Neill|Scarlett Johansson|Dianne Wiest,Robert Redford,170,,
10/4/1997,Jackie Brown,"Jackie Brown is a flight attendant who gets caught in the middle of smuggling cash into the country for her gunrunner boss. When the cops try to use Jackie to get to her boss, she hatches a plan—with help from a bail bondsman—to keep the money for herself. Based on Elmore Leonard's novel “Rum Punch”.",18.897,5146,7.3,en,"Crime, Thriller, Drama",https://image.tmdb.org/t/p/original/ewbLUXvm4riZL0aepy90o0vMesn.jpg,tt0119396,Pam Grier|Samuel L. Jackson|Robert Forster|Bridget Fonda|Michael Keaton,Quentin Tarantino,154,,
25/12/1997,Mr. Magoo,"Mr.Magoo, a man with terrible eyesight, gets caught up in a museum robbery.",13.688,292,4.4,en,"Comedy, Family",https://image.tmdb.org/t/p/original/p24cXStOcsO8DH5ew5Rdf2lQYCa.jpg,tt0119718,Leslie Nielsen|Kelly Lynch|Matt Keeslar|Nick Chinlund|Stephen Tobolowsky,Stanley Tong,84,,
6/3/1998,The Big Lebowski,"Jeffrey ""The Dude"" Lebowski, a Los Angeles slacker who only wants to bowl and drink white Russians, is mistaken for another Jeffrey Lebowski, a wheelchair-bound millionaire, and finds himself dragged into a strange series of events involving nihilists, adult film producers, ferrets, errant toes, and large sums of money.",26.366,9129,7.9,en,"Comedy, Crime",https://image.tmdb.org/t/p/original/5DpmtMBXXNDujIuSlKW3WLKuqEd.jpg,tt0118715,Jeff Bridges|John Goodman|Steve Buscemi|Julianne Moore|David Huddleston,Joel Coen,117,,
10/4/1998,3 Ninjas: High Noon at Mega Mountain,"Three young boys, Rocky, Colt and Tum Tum together with their neighbor girl, computer whiz Amanda are visiting Mega Mountain amusement park when it is invaded by an army of ninjas led by evil Medusa, who wants to take over the park and hold the owners for ransom. Kids and retired TV star Dave Dragon, who made his farewell appearance at the park at the time the ninjas appeared, have to break Medusa's vicious plans.",14.456,153,4.9,en,"Family, Action, Comedy",https://image.tmdb.org/t/p/original/hro6QSAQ9s8slnDtB7SzhjcmTet.jpg,tt0118539,Victor Wong|Mathew Botuchis|Hulk Hogan|Loni Anderson|Jim Varney,Sean McNamara,93,,
20/02/1998,Senseless,A student gets his senses enhanced by an experimental drug. But abuse is not an option.,16.652,269,6.1,en,"Comedy, Romance",https://image.tmdb.org/t/p/original/6hZ7Haicy8QuYYmyv8dEKUeCl1M.jpg,tt0120820,Marlon Wayans|David Spade|Matthew Lillard|Rip Torn|Tamara Taylor,Penelope Spheeris,93,,
25/12/1997,Wag the Dog,"During the final weeks of a presidential race, the President is accused of sexual misconduct. To distract the public until the election, the President's adviser hires a Hollywood producer to help him stage a fake war.",20.523,698,7,en,"Comedy, Drama",https://image.tmdb.org/t/p/original/kAwOj7t8ZeaniTFtLWVSKO79JxX.jpg,tt0120885,Dustin Hoffman|Robert De Niro|Anne Heche|Denis Leary|Willie Nelson,Barry Levinson,97,,
27/02/1998,Dark City,"A man struggles with memories of his past, including a wife he cannot remember, in a nightmarish world with no sun and run by beings with telekinetic powers who seek the souls of humans.",31.277,2126,7.3,en,"Mystery, Science Fiction",https://image.tmdb.org/t/p/original/AdBe2ow8hdlT2aLBYuUjs0Xkqkw.jpg,tt0118929,Rufus Sewell|William Hurt|Kiefer Sutherland|Jennifer Connelly|Richard O'Brien,Alex Proyas,100,,
16/01/1998,Hard Rain,"Get swept up in the action as an armored car driver (Christian Slater) tries to elude a gang of thieves (led by Morgan Freeman) while a flood ravages the countryside. Hard Rain is ""a wild, thrilling, chilling action ride"" filled with close calls, uncertain loyalties and heart-stopping heroics.",13.75,536,5.8,en,"Thriller, Crime, Action",https://image.tmdb.org/t/p/original/hhG5ppaEQIV83GbUVfPlBMDFvVu.jpg,tt0120696,Morgan Freeman|Christian Slater|Randy Quaid|Minnie Driver|Ed Asner,Mikael Salomon,97,,
30/01/1998,Deep Rising,"A group of heavily armed hijackers board a luxury ocean liner in the South Pacific Ocean to loot it, only to do battle with a series of large-sized, tentacled, man-eating sea creatures who have taken over the ship first.",16.566,499,6.1,en,"Adventure, Action, Horror, Science Fiction",https://image.tmdb.org/t/p/original/fCRNZE9HVeMT7T7A5aU3DLxANCX.jpg,tt0118956,Treat Williams|Famke Janssen|Anthony Heald|Kevin J. O'Connor|Una Damon,Stephen Sommers,106,,
5/2/1998,Blues Brothers 2000,"Elwood, the now lone ""Blues Brother"" finally released from prison, is once again enlisted by Sister Mary Stigmata in her latest crusade to raise funds for a children's hospital. Once again hitting the road to re-unite the band and win the big prize at the New Orleans Battle of the Bands, Elwood is pursued cross-country by the cops, led by Cabel the Curtis' son",14.147,511,5.4,en,"Music, Action, Comedy, Crime",https://image.tmdb.org/t/p/original/nCoY8UK2x4DWpICipL40Hg4cDmO.jpg,tt0118747,Dan Aykroyd|John Goodman|Joe Morton|J. Evan Bonifant|B.B. King,John Landis,123,,
13/02/1998,The Wedding Singer,"Robbie, a local rock star turned wedding singer, is dumped on the day of his wedding. Meanwhile, waitress Julia finally sets a wedding date with her fiancée Glenn. When Julia and Robbie meet and hit it off, they find that things are more complicated than anybody thought.",14.994,1359,6.8,en,"Romance, Comedy",https://image.tmdb.org/t/p/original/zVvyTrcZQb7kC2DPDzyo25WcxXp.jpg,tt0120888,Adam Sandler|Drew Barrymore|Christine Taylor|Allen Covert|Jon Lovitz,Frank Coraci,95,,
13/02/1998,Sphere,"The OSSA discovers a spacecraft thought to be at least 300 years old at the bottom of the ocean. Immediately following the discovery, they decide to send a team down to the depths of the ocean to study the space craft.They are the best of best, smart and logical, and the perfect choice to learn more about the spacecraft.",15.446,1240,6.1,en,"Science Fiction, Mystery, Thriller",https://image.tmdb.org/t/p/original/5IMr0L4BoONvN5i9kyVd0zGww3L.jpg,tt0120184,Dustin Hoffman|Sharon Stone|Samuel L. Jackson|Peter Coyote|Liev Schreiber,Barry Levinson,134,,
19/12/1997,As Good as It Gets,"New York City. Melvin Udall, a cranky, bigoted, obsessive-compulsive writer, finds his life turned upside down when neighboring gay artist Simon is hospitalized and his dog is entrusted to Melvin. In addition, Carol, the only waitress who will tolerate him, must leave work to care for her sick son, making it impossible for Melvin to eat breakfast.",21.642,2947,7.4,en,"Comedy, Romance",https://image.tmdb.org/t/p/original/e4DQl8UobpJ0DqTEmQInbWH174A.jpg,tt0119822,Jack Nicholson|Helen Hunt|Greg Kinnear|Cuba Gooding Jr.|Skeet Ulrich,James L. Brooks,139,,
18/07/1990,King of New York,A former drug lord returns from prison determined to wipe out all his competition and distribute the profits of his operations to New York's poor and lower classes in this stylish and ultra violent modern twist on Robin Hood.,15.481,445,6.7,en,"Thriller, Crime",https://image.tmdb.org/t/p/original/p6fVO9NTXrye1yogN0hMSJwpKrV.jpg,tt0099939,Christopher Walken|David Caruso|Laurence Fishburne|Victor Argo|Wesley Snipes,Abel Ferrara,103,,
6/3/1998,U.S. Marshals,"U.S. Marshal Sam Gerard is accompanying a plane load of convicts from Chicago to New York. The plane crashes spectacularly, and Mark Sheridan escapes. But when Diplomatic Security Agent John Royce is assigned to help Gerard recapture Sheridan, it becomes clear that Sheridan is more than just another murderer.",25.73,1196,6.5,en,"Thriller, Crime, Action",https://image.tmdb.org/t/p/original/5ST0BydDSXtW5AtfDDhTVS13pTt.jpg,tt0120873,Tommy Lee Jones|Wesley Snipes|Robert Downey Jr.|Joe Pantoliano|Daniel Roebuck,Stuart Baird,131,,
20/03/1998,Wild Things,"When teen-socialite Kelly Van Ryan (Richards) and troubled bad girl Suzie Toller (Campbell) accuse guidance counselor Sam Lombardo (Dillon) of rape, he's suspended by the school, rejected by the town, and fighting to get his life back. One cop (Bacon) suspects conspiracy, but nothing is what it seems...",23.419,1282,6.3,en,"Mystery, Thriller, Drama",https://image.tmdb.org/t/p/original/NQgGPlw05qHxLaBnqlPBiAZNzE.jpg,tt0120890,Matt Dillon|Kevin Bacon|Denise Richards|Neve Campbell|Theresa Russell,John McNaughton,108,,
17/04/1998,Paulie,"Paulie, an intelligent parrot who actually talks, relates the story of his struggle to a Russian immigrant who works as a janitor at the research institute where he is housed and neglected. Paulie's story begins many years earlier when he is given as a gift to a little girl who stutters. Eventually, he teaches the girl to speak correctly but is taken away by her father because he believes the girl cannot distinguish fantasy from reality because she believes the bird can talk. Paulie goes through a series of adventures with a pawn shop owner, an aging widow, a Mexican-American troubadour and a would be thief before being taken to the institute where he now lives",16.042,355,6.8,en,"Comedy, Family",https://image.tmdb.org/t/p/original/aiW8TWjIuFveTcA5BCU7KMjPaaW.jpg,tt0125454,Gena Rowlands|Tony Shalhoub|Cheech Marin|Bruce Davison|Trini Alvarado,John Roberts,91,,
3/4/1998,Lost in Space,"The prospects for continuing life on Earth in the year 2058 are grim. So the Robinsons are launched into space to colonize Alpha Prime, the only other inhabitable planet in the galaxy. But when a stowaway sabotages the mission, the Robinsons find themselves hurtling through uncharted space.",23.786,963,5.3,en,"Science Fiction, Adventure",https://image.tmdb.org/t/p/original/4miEpZmUOMqV8P0T6oq5HVBiVHw.jpg,tt0120738,Gary Oldman|William Hurt|Matt LeBlanc|Mimi Rogers|Heather Graham,Stephen Hopkins,130,,
3/4/1998,Mercury Rising,"Renegade FBI agent Art Jeffries protects a nine-year-old autistic boy who has cracked the government's new ""unbreakable"" code.",24.723,1201,6.2,en,"Action, Crime, Drama, Thriller",https://image.tmdb.org/t/p/original/60AAso6I2TzQCy2SjqtzPni8csA.jpg,tt0120749,Bruce Willis|Alec Baldwin|Miko Hughes|Chi McBride|Kim Dickens,Harold Becker,111,,
10/4/1998,City of Angels,"When guardian angel Seth -- who invisibly watches over the citizens of Los Angeles -- becomes captivated by Maggie, a strong-willed heart surgeon, he ponders trading in his pure, otherworldly existence for a mortal life with his beloved. The couple embarks on a tender but forbidden romance spanning heaven and Earth.",17.465,1708,6.8,en,"Romance, Drama, Fantasy",https://image.tmdb.org/t/p/original/iuzxpUjHsbQJXV3kB9ZAdCimM60.jpg,tt0120632,Nicolas Cage|Meg Ryan|Andre Braugher|Dennis Franz|Colm Feore,Brad Silberling,114,,
5/12/1997,The Borrowers,"The four-inch-tall Clock family secretly share a house with the normal-sized Lender family, ""borrowing"" such items as thread, safety pins, batteries and scraps of food. However, their peaceful co-existence is disturbed when evil lawyer Ocious P. Potter steals the will granting title to the house, which he plans to demolish in order to build apartments. The Lenders are forced to move, and the Clocks face the risk of being exposed to the normal-sized world.",17.975,383,6,en,"Adventure, Fantasy, Action, Comedy, Family",https://image.tmdb.org/t/p/original/5eYYSd7GkOr7npjio7ce21UU8Um.jpg,tt0118755,John Goodman|Jim Broadbent|Celia Imrie|Tom Felton|Hugh Laurie,Peter Hewitt,86,,
10/4/1998,Species II,"Having just returned from a mission to Mars, Commander Ross isn't exactly himself. He's slowly becoming a terrifying alien entity with one goal -- to procreate with human women! When countless women suffer gruesome deaths after bearing half-alien offspring, scientist Laura Baker and hired assassin Press Lennox use Eve, a more tempered alien clone, to find Ross and his brood. Before long Eve escapes to mate with Ross.",28.146,502,5.1,en,"Science Fiction, Action, Horror",https://image.tmdb.org/t/p/original/bTZOYPnbnTaeiiybtByzWkeb1Gl.jpg,tt0120841,Michael Madsen|Natasha Henstridge|Marg Helgenberger|Mykelti Williamson|George Dzundza,Peter Medak,93,,
1/5/1998,Black Dog,An ex-con takes a job driving a truck cross country. What he doesn't know is that the truck is filled with illegal weapons and now he must fight to survive and save his family.,15.813,176,6.2,en,Action,https://image.tmdb.org/t/p/original/8hvt4L3EXWq3ANutok32ODQIGwV.jpg,tt0120610,Patrick Swayze|Meat Loaf|Randy Travis|Gabriel Casseus|Graham Beckel,Kevin Hooks,88,,
15/05/1998,Quest for Camelot,"During the times of King Arthur, Kayley is a brave girl who dreams of following her late father as a Knight of the Round Table. The evil Ruber wants to invade Camelot and take the throne of King Arthur, and Kayley has to stop him.",35.742,655,6.9,en,"Fantasy, Animation, Drama, Romance, Family",https://image.tmdb.org/t/p/original/xBmKXg0phTpWaJVN0OP6yfGUJur.jpg,tt0120800,Jessalyn Gilsig|Cary Elwes|Gary Oldman|Don Rickles|Jane Seymour,Frederik Du Chau,86,,
22/05/1998,Fear and Loathing in Las Vegas,"The hallucinogenic misadventures of sportswriter Raoul Duke and his Samoan lawyer, Dr. Gonzo, on a three-day romp from Los Angeles to Las Vegas. Motoring across the Mojave Desert on the way to Sin City, Duke and his purple haze passenger ingest a cornucopia of drugs ranging from acid to ether.",27.685,3648,7.2,en,"Adventure, Drama, Comedy",https://image.tmdb.org/t/p/original/jwUnGcLBzKNEIzgUUVWAUSwuuBt.jpg,tt0120669,Johnny Depp|Benicio del Toro|Tobey Maguire|Christina Ricci|Ellen Barkin,Terry Gilliam,118,,
29/05/1998,Almost Heroes,"Two hapless explorers lead an ill-fated 1804 expedition through the Pacific Northwest in a hopeless, doomed effort to reach the Pacific Ocean before Lewis and Clark.",15.564,135,5.6,en,"Adventure, Comedy, Western",https://image.tmdb.org/t/p/original/qO1cfr4UxcwQ858Nxp470QNS3v8.jpg,tt0119053,Chris Farley|Matthew Perry|Bokeem Woodbine|Barry Del Sherman|Eugene Levy,Christopher Guest,90,,
12/6/1998,Six Days Seven Nights,"When Quinn, a grouchy pilot living the good life in the South Pacific, agrees to transfer a savvy fashion editor, Robin, to Tahiti, he ends up stranded on a deserted island with her after their plane crashes. The pair avoid each other at first, until they're forced to team up to escape from the island -- and some pirates who want their heads.",30.125,1100,6,en,"Adventure, Action, Comedy, Romance",https://image.tmdb.org/t/p/original/fzWrrCzRa16v51TXAUuT6Wendw7.jpg,tt0120828,Harrison Ford|Anne Heche|David Schwimmer|Jacqueline Obradors|Temuera Morrison,Ivan Reitman,98,,
12/6/1998,Can't Hardly Wait,"It's graduation day at Huntington Hills High, and you know what that means - time to party. And not just any party, either. This one will be a night to remember, as the nerds become studs, the jocks are humiliated, and freshman crushes blossom into grown-up romance.",17.49,404,6.3,en,"Comedy, Romance",https://image.tmdb.org/t/p/original/r3a5gGWfS0SDS9nriNrJzSSrErf.jpg,tt0127723,Jennifer Love Hewitt|Ethan Embry|Charlie Korsmo|Lauren Ambrose|Peter Facinelli,Harry Elfont|Deborah Kaplan,100,,
18/06/1998,Mulan,"A tomboyish girl disguises herself as a young man so she can fight with the Imperial Chinese Army against the invading Huns. With help from wise-cracking dragon Mushu, Mulan just might save her country -- and win the heart of handsome Captain Li Shang.",129.338,7900,7.9,en,"Animation, Family, Adventure",https://image.tmdb.org/t/p/original/5TYgKxYhnhRNNwqnRAKHkgfqi2G.jpg,tt0120762,Ming-Na Wen|Lea Salonga|June Foray|Soon-Tek Oh|Freda Foh Shen,Tony Bancroft|Barry Cook,88,,
19/06/1998,The X Files,"Mulder and Scully, now taken off the FBI's X Files cases, must find a way to fight the shadowy elements of the government to find out the truth about a conspiracy that might mean the alien colonization of Earth.",25.049,1212,6.8,en,"Mystery, Science Fiction, Thriller",https://image.tmdb.org/t/p/original/yLIw6shz2WC3W3iI0jROsF4B2ha.jpg,tt0120902,David Duchovny|Gillian Anderson|Mitch Pileggi|William B. Davis|John Neville,Rob Bowman,121,,
26/06/1998,Doctor Dolittle,"A successful physician and devoted family man, John Dolittle (Eddie Murphy) seems to have the world by the tail, until a long suppressed talent he possessed as a child, the ability to communicate with animals is suddenly reawakened with a vengeance! Now every creature within squawking distance wants the good doctor's advice, unleashing an outrageous chain of events that turns his world upside down!",26.041,2495,5.7,en,"Comedy, Family, Fantasy",https://image.tmdb.org/t/p/original/tLrchGMIkdo1KamQJA6fwvDQEy0.jpg,tt0118998,Eddie Murphy|Ossie Davis|Oliver Platt|Peter Boyle|Richard Schiff,Betty Thomas,85,,
26/06/1998,Out of Sight,"Meet Jack Foley, a smooth criminal who bends the law and is determined to make one last heist. Karen Sisco is a federal marshal who chooses all the right moves … and all the wrong guys. Now they're willing to risk it all to find out if there's more between them than just the law. Variety hails Out of Sight as ""a sly, sexy, vastly entertaining film.""",15.806,955,6.6,en,"Romance, Comedy, Crime",https://image.tmdb.org/t/p/original/7J9LtfRLuVnH14WpFGgTxC4Oo0c.jpg,tt0120780,George Clooney|Jennifer Lopez|Michael Keaton|Samuel L. Jackson|Dennis Farina,Steven Soderbergh,123,,
